{
  "artifact": {
    "byte_length": 329,
    "path": "research_notes/m4_deliverable.md",
    "sha256": "d406bdac4738ce8a1836fe58925e43b90378596e8fc38263e82402b2b5d07ec5"
  },
  "claim_register": {
    "byte_length": 1103,
    "path": "research_notes/terminal-m4-claim-register.json",
    "sha256": "aadfda9cce2169efcf2a22ab66e925e1a581905a0fdf0d92a3d4a8a9840d11b7"
  },
  "created_at": "2026-07-26T00:00:04Z",
  "dispatch_separation": {
    "evaluator_claim_id": "dispatch-3da88bc9f933b636",
    "generator_claim_id": "dispatch-03f12c2c9a87b9e8",
    "independence_level": "dispatch_separation",
    "separate": true
  },
  "evaluation_dispatch": {
    "claim": {
      "byte_length": 6009,
      "path": "reviews/.harness/assignment/dispatch/claims/dispatch-3da88bc9f933b636/claim.json",
      "sha256": "e9fc5ddd1a58bdd49ce9a338c30f14b23ed286eee274462a6aaf1b5244ec167a"
    },
    "consumer_transaction_id": "scholarly-evaluation:SET-TERMINAL_M4"
  },
  "evaluation_id": "SET-TERMINAL_M4",
  "findings": [],
  "generator_envelope": {
    "byte_length": 316,
    "path": "research_notes/terminal-m4-generator-envelope.json",
    "sha256": "fda97c91199b07462e030e00d50779a88e4b029f3c7a91b144b859b6929af514"
  },
  "milestone_criteria": {
    "byte_length": 117,
    "path": "research_notes/terminal-m4-milestone-criteria.json",
    "sha256": "ecef1252017ce6fe29c48b2b94701e4ed75b094aec01662318b4b282ef4e8d43"
  },
  "obligation_results": [],
  "omitted_checks": [],
  "schema_version": "1.0.0",
  "scholarly_profile": {
    "byte_length": 2220,
    "path": "research_notes/terminal-m4-scholarly-profile.json",
    "sha256": "1d52394b68370ef21c244017d4659ad1ab2fec7035e0aa1a89f3e230bb2dea1c"
  },
  "verdict": {
    "check_results": [
      {
        "check_id": "milestone_criteria",
        "evidence": [
          {
            "byte_length": 329,
            "path": "research_notes/m4_deliverable.md",
            "sha256": "d406bdac4738ce8a1836fe58925e43b90378596e8fc38263e82402b2b5d07ec5"
          }
        ],
        "reasoning": "The independent synthetic Evaluator recorded a bounded pass.",
        "status": "pass"
      },
      {
        "check_id": "claim_register",
        "evidence": [
          {
            "byte_length": 329,
            "path": "research_notes/m4_deliverable.md",
            "sha256": "d406bdac4738ce8a1836fe58925e43b90378596e8fc38263e82402b2b5d07ec5"
          }
        ],
        "reasoning": "The independent synthetic Evaluator recorded a bounded pass.",
        "status": "pass"
      },
      {
        "check_id": "scope_quantifier",
        "evidence": [
          {
            "byte_length": 329,
            "path": "research_notes/m4_deliverable.md",
            "sha256": "d406bdac4738ce8a1836fe58925e43b90378596e8fc38263e82402b2b5d07ec5"
          }
        ],
        "reasoning": "The independent synthetic Evaluator recorded a bounded pass.",
        "status": "pass"
      },
      {
        "check_id": "provenance_integrity",
        "evidence": [
          {
            "byte_length": 329,
            "path": "research_notes/m4_deliverable.md",
            "sha256": "d406bdac4738ce8a1836fe58925e43b90378596e8fc38263e82402b2b5d07ec5"
          }
        ],
        "reasoning": "The independent synthetic Evaluator recorded a bounded pass.",
        "status": "pass"
      },
      {
        "check_id": "admission_use",
        "evidence": [
          {
            "byte_length": 329,
            "path": "research_notes/m4_deliverable.md",
            "sha256": "d406bdac4738ce8a1836fe58925e43b90378596e8fc38263e82402b2b5d07ec5"
          }
        ],
        "reasoning": "The independent synthetic Evaluator recorded a bounded pass.",
        "status": "pass"
      },
      {
        "check_id": "argument_leg",
        "evidence": [
          {
            "byte_length": 329,
            "path": "research_notes/m4_deliverable.md",
            "sha256": "d406bdac4738ce8a1836fe58925e43b90378596e8fc38263e82402b2b5d07ec5"
          }
        ],
        "reasoning": "The independent synthetic Evaluator recorded a bounded pass.",
        "status": "pass"
      },
      {
        "check_id": "warrant_logic",
        "evidence": [
          {
            "byte_length": 329,
            "path": "research_notes/m4_deliverable.md",
            "sha256": "d406bdac4738ce8a1836fe58925e43b90378596e8fc38263e82402b2b5d07ec5"
          }
        ],
        "reasoning": "The independent synthetic Evaluator recorded a bounded pass.",
        "status": "pass"
      },
      {
        "check_id": "modal_consistency",
        "evidence": [
          {
            "byte_length": 329,
            "path": "research_notes/m4_deliverable.md",
            "sha256": "d406bdac4738ce8a1836fe58925e43b90378596e8fc38263e82402b2b5d07ec5"
          }
        ],
        "reasoning": "The independent synthetic Evaluator recorded a bounded pass.",
        "status": "pass"
      },
      {
        "check_id": "grounding_citation",
        "evidence": [
          {
            "byte_length": 329,
            "path": "research_notes/m4_deliverable.md",
            "sha256": "d406bdac4738ce8a1836fe58925e43b90378596e8fc38263e82402b2b5d07ec5"
          }
        ],
        "reasoning": "The independent synthetic Evaluator recorded a bounded pass.",
        "status": "pass"
      },
      {
        "check_id": "d_style",
        "evidence": [
          {
            "byte_length": 329,
            "path": "research_notes/m4_deliverable.md",
            "sha256": "d406bdac4738ce8a1836fe58925e43b90378596e8fc38263e82402b2b5d07ec5"
          }
        ],
        "reasoning": "The independent synthetic Evaluator recorded a bounded pass.",
        "status": "pass"
      },
      {
        "check_id": "reader_accessibility",
        "evidence": [
          {
            "byte_length": 329,
            "path": "research_notes/m4_deliverable.md",
            "sha256": "d406bdac4738ce8a1836fe58925e43b90378596e8fc38263e82402b2b5d07ec5"
          }
        ],
        "reasoning": "The independent synthetic Evaluator recorded a bounded pass.",
        "status": "pass"
      },
      {
        "check_id": "active_overlays",
        "evidence": [
          {
            "byte_length": 329,
            "path": "research_notes/m4_deliverable.md",
            "sha256": "d406bdac4738ce8a1836fe58925e43b90378596e8fc38263e82402b2b5d07ec5"
          }
        ],
        "reasoning": "The independent synthetic Evaluator recorded a bounded pass.",
        "status": "pass"
      }
    ],
    "status": "qualified"
  }
}
