{
  "artifact": {
    "byte_length": 329,
    "path": "research_notes/m5_deliverable.md",
    "sha256": "1f1fcd21699475f9b844feb0f248dea00764d9301da6131aa0fb05158f4c276a"
  },
  "claim_register": {
    "byte_length": 1103,
    "path": "research_notes/terminal-m5-claim-register.json",
    "sha256": "f45c268586d73995492963e6eb9b81794e1ef1320e33540bff7322e5b2fbf246"
  },
  "created_at": "2026-07-26T00:00:04Z",
  "dispatch_separation": {
    "evaluator_claim_id": "dispatch-6db4aa252b954c54",
    "generator_claim_id": "dispatch-06eda12b2f5c023b",
    "independence_level": "dispatch_separation",
    "separate": true
  },
  "evaluation_dispatch": {
    "claim": {
      "byte_length": 6018,
      "path": "reviews/.harness/assignment/dispatch/claims/dispatch-6db4aa252b954c54/claim.json",
      "sha256": "f98ee2c459ff05b62e4d53e7483ca23349224b1717b6bfe282f152f412a1f1a4"
    },
    "consumer_transaction_id": "scholarly-evaluation:SET-TERMINAL_M5"
  },
  "evaluation_id": "SET-TERMINAL_M5",
  "findings": [],
  "generator_envelope": {
    "byte_length": 316,
    "path": "research_notes/terminal-m5-generator-envelope.json",
    "sha256": "a97825046055bc36de4054290dfd6667b5cc3a76ed656cae6204000759cb474f"
  },
  "milestone_criteria": {
    "byte_length": 117,
    "path": "research_notes/terminal-m5-milestone-criteria.json",
    "sha256": "ecef1252017ce6fe29c48b2b94701e4ed75b094aec01662318b4b282ef4e8d43"
  },
  "obligation_results": [],
  "omitted_checks": [],
  "schema_version": "1.0.0",
  "scholarly_profile": {
    "byte_length": 2220,
    "path": "research_notes/terminal-m5-scholarly-profile.json",
    "sha256": "bc382f31edab38df44553d98c1627f4d681a2ab6edc2208ebd5833dac2cf984d"
  },
  "verdict": {
    "check_results": [
      {
        "check_id": "milestone_criteria",
        "evidence": [
          {
            "byte_length": 329,
            "path": "research_notes/m5_deliverable.md",
            "sha256": "1f1fcd21699475f9b844feb0f248dea00764d9301da6131aa0fb05158f4c276a"
          }
        ],
        "reasoning": "The independent synthetic Evaluator recorded a bounded pass.",
        "status": "pass"
      },
      {
        "check_id": "claim_register",
        "evidence": [
          {
            "byte_length": 329,
            "path": "research_notes/m5_deliverable.md",
            "sha256": "1f1fcd21699475f9b844feb0f248dea00764d9301da6131aa0fb05158f4c276a"
          }
        ],
        "reasoning": "The independent synthetic Evaluator recorded a bounded pass.",
        "status": "pass"
      },
      {
        "check_id": "scope_quantifier",
        "evidence": [
          {
            "byte_length": 329,
            "path": "research_notes/m5_deliverable.md",
            "sha256": "1f1fcd21699475f9b844feb0f248dea00764d9301da6131aa0fb05158f4c276a"
          }
        ],
        "reasoning": "The independent synthetic Evaluator recorded a bounded pass.",
        "status": "pass"
      },
      {
        "check_id": "provenance_integrity",
        "evidence": [
          {
            "byte_length": 329,
            "path": "research_notes/m5_deliverable.md",
            "sha256": "1f1fcd21699475f9b844feb0f248dea00764d9301da6131aa0fb05158f4c276a"
          }
        ],
        "reasoning": "The independent synthetic Evaluator recorded a bounded pass.",
        "status": "pass"
      },
      {
        "check_id": "admission_use",
        "evidence": [
          {
            "byte_length": 329,
            "path": "research_notes/m5_deliverable.md",
            "sha256": "1f1fcd21699475f9b844feb0f248dea00764d9301da6131aa0fb05158f4c276a"
          }
        ],
        "reasoning": "The independent synthetic Evaluator recorded a bounded pass.",
        "status": "pass"
      },
      {
        "check_id": "argument_leg",
        "evidence": [
          {
            "byte_length": 329,
            "path": "research_notes/m5_deliverable.md",
            "sha256": "1f1fcd21699475f9b844feb0f248dea00764d9301da6131aa0fb05158f4c276a"
          }
        ],
        "reasoning": "The independent synthetic Evaluator recorded a bounded pass.",
        "status": "pass"
      },
      {
        "check_id": "warrant_logic",
        "evidence": [
          {
            "byte_length": 329,
            "path": "research_notes/m5_deliverable.md",
            "sha256": "1f1fcd21699475f9b844feb0f248dea00764d9301da6131aa0fb05158f4c276a"
          }
        ],
        "reasoning": "The independent synthetic Evaluator recorded a bounded pass.",
        "status": "pass"
      },
      {
        "check_id": "modal_consistency",
        "evidence": [
          {
            "byte_length": 329,
            "path": "research_notes/m5_deliverable.md",
            "sha256": "1f1fcd21699475f9b844feb0f248dea00764d9301da6131aa0fb05158f4c276a"
          }
        ],
        "reasoning": "The independent synthetic Evaluator recorded a bounded pass.",
        "status": "pass"
      },
      {
        "check_id": "grounding_citation",
        "evidence": [
          {
            "byte_length": 329,
            "path": "research_notes/m5_deliverable.md",
            "sha256": "1f1fcd21699475f9b844feb0f248dea00764d9301da6131aa0fb05158f4c276a"
          }
        ],
        "reasoning": "The independent synthetic Evaluator recorded a bounded pass.",
        "status": "pass"
      },
      {
        "check_id": "d_style",
        "evidence": [
          {
            "byte_length": 329,
            "path": "research_notes/m5_deliverable.md",
            "sha256": "1f1fcd21699475f9b844feb0f248dea00764d9301da6131aa0fb05158f4c276a"
          }
        ],
        "reasoning": "The independent synthetic Evaluator recorded a bounded pass.",
        "status": "pass"
      },
      {
        "check_id": "reader_accessibility",
        "evidence": [
          {
            "byte_length": 329,
            "path": "research_notes/m5_deliverable.md",
            "sha256": "1f1fcd21699475f9b844feb0f248dea00764d9301da6131aa0fb05158f4c276a"
          }
        ],
        "reasoning": "The independent synthetic Evaluator recorded a bounded pass.",
        "status": "pass"
      },
      {
        "check_id": "active_overlays",
        "evidence": [
          {
            "byte_length": 329,
            "path": "research_notes/m5_deliverable.md",
            "sha256": "1f1fcd21699475f9b844feb0f248dea00764d9301da6131aa0fb05158f4c276a"
          }
        ],
        "reasoning": "The independent synthetic Evaluator recorded a bounded pass.",
        "status": "pass"
      }
    ],
    "status": "qualified"
  }
}
